{
  "meta": {
    "style_id": "anthropic-claude",
    "version": "0.2.0",
    "confidence": "partial"
  },
  "color": {
    "canvas": {"value": "#F7F5EF", "role": "warm paper / ivory canvas", "confidence": "observed"},
    "surface": {"value": "#FFFDF8", "role": "card/form/modal surface", "confidence": "observed"},
    "surface_muted": {"value": "#EEE8DC", "role": "pale beige product card / selected state", "confidence": "observed"},
    "text_primary": {"value": "#1F1F1F", "role": "charcoal primary text and dark CTA", "confidence": "observed"},
    "text_secondary": {"value": "#66615A", "role": "muted label/body text", "confidence": "observed"},
    "border_subtle": {"value": "#DED7CC", "role": "warm-gray border/divider", "confidence": "inferred"},
    "accent_clay": {"value": "#D97757", "role": "Claude clay/terracotta identity accent", "confidence": "extracted"},
    "accent_send": {"value": "#B85C38", "role": "warm run/send/action accent when black CTA is too heavy", "confidence": "observed"},
    "inverse_surface": {"value": "#191817", "role": "dark developer/code card", "confidence": "observed"},
    "inverse_text": {"value": "#F7F5EF", "role": "text on dark cards", "confidence": "observed"}
  },
  "typography": {
    "brand_headline": {"family": "refined serif or serif-like display", "usage": "brand/editorial headlines", "confidence": "observed"},
    "brand_body": {"family": "serif or literary text", "usage": "short marketing body copy when editorial", "confidence": "observed"},
    "ui": {"family": "compact humanist/system sans", "usage": "navigation, buttons, forms, app labels", "confidence": "observed"},
    "mono": {"family": "monospace", "usage": "code/data only", "confidence": "observed"}
  },
  "spacing": {
    "density": "comfortable editorial; compact in sidebars/composers",
    "scale": [4, 8, 12, 16, 24, 32, 48, 72],
    "modal_padding": "32-40px",
    "card_padding": "32-56px",
    "sidebar_padding": "8-16px"
  },
  "radius": {
    "button": "8-999px depending on context",
    "composer": "12px",
    "card": "20-32px for marketing cards; 12-16px for app cards",
    "modal": "16px"
  },
  "border": {
    "default": "1px solid var(--dsl-border-subtle)",
    "selected_state": "pale fill rather than heavy stroke"
  },
  "shadow": {
    "card": "subtle or none; prefer fill contrast",
    "modal": "soft low-elevation shadow",
    "composer": "thin border plus minimal elevation"
  },
  "motion": {
    "default": "calm short transitions",
    "avoid": "springy/playful motion unless used as tiny empty-state personality"
  },
  "density": {
    "marketing": "low",
    "workbench_canvas": "low",
    "sidebar": "medium compact",
    "composer": "medium compact"
  }
}
